{"$schema":"https://json-schema.org/draft/2020-12/schema","additionalProperties":false,"description":"Hash-bound human review decision; semantic validation is enforced by dpslab.proposal_review.","properties":{"binding":{"type":"object"},"decision":{"type":"object"},"identity":{"type":"object"},"integrity":{"type":"object"},"schema_version":{"const":"0.1"}},"required":["schema_version","identity","binding","decision","integrity"],"title":"DpsLab proposal review decision 0.1","type":"object"}
