{"binding":{"catalog_sha256":"decef73f2d25d82a174e27c50d9584be3f11037328ab660a6fe6f04e189d70e9","evidence_sha256":"758e833e0fefdcc291e505e051113bf1a0ba58008498a11a0ae3ad6494cac44b","proposal_id":"proposal.synthetic.patch.120500.1","proposal_sha256":"9b0256a5f40445c8448e66713d7774067b887ce627d4b44e0b4b95c0648fd866"},"decision":{"authority_reference":"synthetic.authority.1","decided_at":"2026-07-31T16:30:00Z","limitations_acknowledged":["requires_human_review","synthetic_fixture_only"],"outcome":"approved","reason_codes":["synthetic_evidence_reviewed"],"reviewer_id":"synthetic.reviewer"},"identity":{"created_at":"2026-07-31T16:30:00Z","decision_id":"synthetic.decision.1"},"integrity":{"decision_sha256":"76a6fa2410389e46b4410469a16b9bc8078e5d92a7db01fc913ba6a5021c2583","hash_algorithm":"sha256"},"schema_version":"0.1"}
